,Review,Calification
0,"Metan fundamentos con ella sin pensarlo. Si no les interesa la Contabilidad van a pasar fácil, y si les gusta un poco más van a dejar la nota muy alta. La profe siempre resuelve todas sus dudas respondiendo amablemente. Y la metodología que aplica a los parciales hace que no sean difíciles.",5.0
1,"El profesor es buenísimo, es el mejor en su materia. Es muy amable. Cuando no presentan cosas deja que las entreguen después. La clase es muy amena ",5.0
2,"La materia es muy buena, y muy interesante, el profesor a veces es raro para explicar. 
Se trata de unas lecturas y su respectivo resumen y en la parte final del semestre se aprende a negociar de verdad.
Muy util para la vida.",4.0
3,"La clase es muy buena, contrario a lo que se pensaría, no se centra en el ámbito empresarial. El docente deja los conceptos realmente claros y las actividades son interesantes. ",5.0
4,"Metan fundamentos con ella sin pensarlo. Si no les interesa la Contabilidad van a pasar fácil, y si les gusta un poco más van a dejar la nota muy alta. La profe siempre resuelve todas sus dudas respondiendo amablemente. Y la metodología que aplica a los parciales hace que no sean difíciles.",5.0
5,"El profesor es buenísimo, es el mejor en su materia. Es muy amable. Cuando no presentan cosas deja que las entreguen después. La clase es muy amena ",5.0
6,"La materia es muy buena, y muy interesante, el profesor a veces es raro para explicar. 
Se trata de unas lecturas y su respectivo resumen y en la parte final del semestre se aprende a negociar de verdad.
Muy util para la vida.",4.0
7,"La clase es muy buena, contrario a lo que se pensaría, no se centra en el ámbito empresarial. El docente deja los conceptos realmente claros y las actividades son interesantes. ",5.0
8,"Metan fundamentos con ella sin pensarlo. Si no les interesa la Contabilidad van a pasar fácil, y si les gusta un poco más van a dejar la nota muy alta. La profe siempre resuelve todas sus dudas respondiendo amablemente. Y la metodología que aplica a los parciales hace que no sean difíciles.",5.0
9,"El profesor es buenísimo, es el mejor en su materia. Es muy amable. Cuando no presentan cosas deja que las entreguen después. La clase es muy amena ",5.0
10,"La materia es muy buena, y muy interesante, el profesor a veces es raro para explicar. 
Se trata de unas lecturas y su respectivo resumen y en la parte final del semestre se aprende a negociar de verdad.
Muy util para la vida.",4.0
11,"La clase es muy buena, contrario a lo que se pensaría, no se centra en el ámbito empresarial. El docente deja los conceptos realmente claros y las actividades son interesantes. ",5.0
12,"Metan fundamentos con ella sin pensarlo. Si no les interesa la Contabilidad van a pasar fácil, y si les gusta un poco más van a dejar la nota muy alta. La profe siempre resuelve todas sus dudas respondiendo amablemente. Y la metodología que aplica a los parciales hace que no sean difíciles.",5.0
13,"El profesor es buenísimo, es el mejor en su materia. Es muy amable. Cuando no presentan cosas deja que las entreguen después. La clase es muy amena ",5.0
14,"La materia es muy buena, y muy interesante, el profesor a veces es raro para explicar. 
Se trata de unas lecturas y su respectivo resumen y en la parte final del semestre se aprende a negociar de verdad.
Muy util para la vida.",4.0
15,"La clase es muy buena, contrario a lo que se pensaría, no se centra en el ámbito empresarial. El docente deja los conceptos realmente claros y las actividades son interesantes. ",5.0
16,"Metan fundamentos con ella sin pensarlo. Si no les interesa la Contabilidad van a pasar fácil, y si les gusta un poco más van a dejar la nota muy alta. La profe siempre resuelve todas sus dudas respondiendo amablemente. Y la metodología que aplica a los parciales hace que no sean difíciles.",5.0
17,"El profesor es buenísimo, es el mejor en su materia. Es muy amable. Cuando no presentan cosas deja que las entreguen después. La clase es muy amena ",5.0
18,"La materia es muy buena, y muy interesante, el profesor a veces es raro para explicar. 
Se trata de unas lecturas y su respectivo resumen y en la parte final del semestre se aprende a negociar de verdad.
Muy util para la vida.",4.0
19,"La clase es muy buena, contrario a lo que se pensaría, no se centra en el ámbito empresarial. El docente deja los conceptos realmente claros y las actividades son interesantes. ",5.0
20,"Excelente profesora, se aprende un montón y la clase es muy entretenida y usa muchos ejemplos parahacer mas comprensibles los temas.: Entretenido: Parciales un poco complejos",5.0
21,"Excelente docente, muy recomendada para ver derecho laboral.: Explica los temas con paciencia y con muchos ejemplos.
Los parciales son sencillos y corresponden a lo visto en clase.
Se abarcan todos los temas del programa.
Es muy atenta respondiendo dudas",5.0
22,"En el area de mercados es la mejor profesora que tiene la facultad.
Se entiende todo lo que explica, las clases son entretenidas e interactivas, usa muchos ejemplos y los temas se interiorizan. 
Su metodología es sencilla.",5.0
23,": Facil
Entretenido
Temas interesantes: Hermético 
A veces la unica respuesta correcta, es la que el quiere.",4.0
24,"Es un muy buen profesor, muy didáctico, y hace a los estudiantes muy participes en sus clases",5.0
25,"Excelente profesor, muy buena dinámica en clases, muy dinámico, propone actividades extracurriculares y explica muy bien todos los temas y conceptos. : Exonera del examen final ",5.0
26,"Execelente profesor. Clases y evaluaciones dinamicas, divertidas y creativas. Sabe de motivacion y incentivos, como un buen lider. No significa que es facil. : Todo en el comentario: a veces hace unos chistes machistas",5.0
27,"...: El 100% de la materia consiste en la presentación de talleres individuales y grupales
Hace las clases amenas y trata de explicar con claridad los temas
La materia es extremadamente fácil de aprobar.: Siempre llega 30-40 minutos tarde.
Se desconoce la retroalimentación de los talleres.
Son muy pocos talleres por semestre, así que la nota de la materia es muy volátil.
Falta mucho a clase
El programa del curso no se termina pues su ausentismo le impide dictar los temas en su totalidad",3.0
28,"No es facil entenderle, va muy rapido y no va a la par con las lecturas que deja, de hecho no explica casa nada de las lecturas. Lo bueno es que los parciales deja que se pueda hablar entre compañeros y sacar cuaderno, los talleres son un poco dificiles. : Se puede dejar alta: No se aprende mucho ",3.6
29,"Excelente profesor, se aprende muchísimo y tiene mucha paciencia para explicar. Todo lo ejemplifica y es muy justo con las notas. Hay que hacer 3 parciales, talleres y un trabajo final.
Todos los exámenes que hace deja sacar todo, lecturas, computadores y celulares, evalua es que usted sepa hacer un análisis financiero.",5.0
30,"Es una profesora excelente, y si tu vas a todas las clases y prestas atención se puede dejar muy alta, hace tres parciales de selección múltiple mayormente, algunos de casos, y hace talleres en clase.: La profesora explica muy bien, vale completamente la pena para ser una clase que cuando la vi era un sábado se iba con agrado ",5.0
31,"Es una profesora excelente, y si tu vas a todas las clases y prestas atención se puede dejar muy alta, hace tres parciales de selección múltiple mayormente, algunos de casos, y hace talleres en clase.: La profesora explica muy bien, vale completamente la pena para ser una clase que cuando la vi era un sábado se iba con agrado ",5.0
32,"Es una profesora excelente, y si tu vas a todas las clases y prestas atención se puede dejar muy alta, hace tres parciales de selección múltiple mayormente, algunos de casos, y hace talleres en clase.: La profesora explica muy bien, vale completamente la pena para ser una clase que cuando la vi era un sábado se iba con agrado ",5.0
33,"Las clases son tremendamente aburridas, cuando yo la ví, todo el tiempo dicto las clases leyendo un libro literalmente, como si no las tuviera preparadas. Supongo que eventualmente el profesor sabe del tema dado que es muy respetado en la facultad, pero no me gustó la clase por eso.
Al principio de las clases siempre se debe hablar de los comentari...Leer más...",3.0
34,"Metan fundamentos con ella sin pensarlo. Si no les interesa la Contabilidad van a pasar fácil, y si les gusta un poco más van a dejar la nota muy alta. La profe siempre resuelve todas sus dudas respondiendo amablemente. Y la metodología que aplica a los parciales hace que no sean difíciles.",5.0
35,"Buena profesora, domina los temas su materia: Se esmera por hacer su clase dinámica.
La materia se puede aprobar con una nota muy alta.
Se puede aprender bastante de ella y de las lecturas que asigna en la clase: Se frustra con facilidad cuando los estudiantes no participan.",4.0
36,": Materia fácil de aprobar y conseguir una nota muy alta.
Los parciales son planteados con base en los talleres que se realizan durante el transcurso del semestre.: El docente faltó mucho a clase, la mayoría de los temas se vieron mediante el texto guía. ",3.2
37,"El profesor tiene mucho conocimiento sobre lo que expone, lo que hace que la clase sea amena. Lo negativo es que no entrega notas sino hasta el final del curso y que a veces no le alcanza el tiempo para todos los temas del curso",4.0
38,"Las clases son dinámicas, tiene un gran conocimiento especialmente en marketing, se preocupa porque el estudiante sepa aplicar los conceptos de la clase.: Si realiza todos los trabajos como mapas conceptuales, así no los evalúe periódicamente, al final puede ayudarle con la nota  ",4.4
39,"Gran profesor, tiene un excelente conocimiento de los temas. Especialmente los relacionados con marketing.",4.6
40,"Es muy buen profesor, pero a veces tiene una actitud extraña, se cumple a cabalidad con los temas y se aprende un montón.: Aprendizaje: Actitud",4.0
41,"Si de verdad se quiere aprender, con Jair debes meter.",4.0
42,"No tiene un ""ego gigante"", más bien es consciente de lo que sabe y su valor como profesional, algo de lo cual deberíamos aprenderle; por el contrario se preocupa mucho por ayudar a los estudiantes (no en su materia, sino a nivel general) a solucionar sus inconvenientes, especialmente los que tengan que ver con la parte administrativa.

Es un profes...Leer más...",4.5
43,"Jair es un buen profesor con el cual vi mercados 1, el profe sabe muchísimo de marketing y tiene una experiencia ""amplisima"" que no parara de recordares en cada clase. Explica los temas muy bien y tal ves es uno de los conocedores mas jovenes de los temas de la clase. Todo lo explica con ejemplos de la vida y de sus experiencias y la mayor parte de...Leer más...: Si participas en clase muy seguramente obtendras buena nota: No da nunca una retroalimentación 
Tiene un ego mas grande que cualquiera
Las notas del semestre o resúmenes no importaran, solo importan los quizes de 1 minuto y el análisis del sector",2.9
44,Muy buena clase. Le abre a uno la mente especialmente con las historias que cuenta sobre los grupos economicos del país. Vale la pena leer el material del curso,5.0
45,"Es la mejor profesora para ver fundamentos de finanzas ya que explica muy bien ya atraves de talleres, los temas quedan muy claro.
El trabajo en final es en grupo. Los parciales son ejercicios que ya ha explicado.: Su tono de voz es muy bajo, si uno se hace atrás seguramente se pierde la mitad de lo que dice.",4.0
46,Gran profesora de entiende todos los temas y se nota el gran manejo de la profesora ,5.0
47,Es un gran profesor aunque a veces puede ser un poco aburrido,5.0
48,"Es un profesor que lo inspira a uno a estudiar Ingeniería Industrial para aportarle a la sociedad, es buena gente, a veces habla muy rápido.: Es muy dedicado con las clases, da muchos ejemplos sobre los temas de clase.: Permite que los estudiantes que llegan tarde a clase ingresen al salón, esto crea interrupciones.

",4.8
49,Clases entretenidas y fuera de lo común. : Actividades que ayudan a pensar de forma creativa: Las clases teóricas chocan mucho con las clases prácticas,5.0
50,"Profesor muy dedicado a las materias que dicta, los talleres y actividades tienen relación a la empresa real y casos que se pueden presentar en las organizaciones.  Explica los temas de producción 2 muy digeribles y con una visión muy ingenieril . Recomiendo 100% ver cualquier materia con este profesor y pese a que es joven, le gusta enseñar y compartir toda su experiencia como emprendedor. : Cómo fue monitor del profesor Luis Alejandro Rodriguez, entiende los problemas que se les presentan a los estudiantes. : Ninguna",5.0
51,"Muy buen docente, le gusta enseñar, prepara sus clases con dedicación porque usa muchos materiales para las actividades, no cobra las fotocopias de las actividades.: Prepara muy bien las actividades de clase, respeta las fechas de los parciales.: Llama a lista justo cuando uno no va a clase.",5.0
52,"Muy buena gente, pone actividades que abren la mente.: Actividades muy chéveres: Ninguno",5.0
53,"la otra reseña parece preparada por el mismo a varios no les gusto, perdió tiempo en talleres que no aportan mucho y no cubre temas importantes.: facil: la clase la hace el estudiante, el no hizo mucho",1.5
54,"Pues el man es muy bacano, buena gente pero se me hace que es muy escuelero, se la deja montar de los alumnos y sus actividades son algo infantiles, le apasiona enseñar pero la materia en realidad se me hizo poco atractiva, es un relajo y pues senti perdidos esos 3 creditos.: La nota puede quedar muy alta, cinqueable.: Son muy jartas sus clases, se la deja montar, es escuelero y sus actividades pueden llegar a ser ridiculas.
Perdida de creditos.",3.5
55,"Fue de las primeras materias que tome como electiva buscando un curso introductorio y agradable, no me quede decepcionado. Freddy es un buen docente, aunque se pase mucho usando diapositivas, logra dar temas ladrilludos de contabilidad de forma amena y la ayuda del monitor para complementar es perfecta! : - Sabe como dar un curso introductorio 
- Su experiencia profesional juega un papel importante
- Trata bien a quienes no pertenecemos a la FCE: - Los temas de contabilidad son largos y complicados",4.5
56," empezó a ser un profesor decente luego de el primer parcial, y que cancelaran muchos de los estudiantes: A veces en clase hablaba de cosas muy interesantes: No explica bien, asume que todo lo sabes ya, no responde las preguntas",3.8
57," empezó a ser un profesor decente luego de el primer parcial, y que cancelaran muchos de los estudiantes: A veces en clase hablaba de cosas muy interesantes: No explica bien, asume que todo lo sabes ya, no responde las preguntas",3.8
58,": Se aborda el programa de la materia en su totalidad.
Responde a las dudas de forma respetuosa.
Se esmera por que el estudiante entienda las temáticas abordadas.: Los parciales son netamente memorísticos.",4.7
59,"El profesor se preocupa por dar una mirada crítica y hacer la cláse práctica. Lo más importante es que con él se aprende y se le puede consultar sin problema de temas interesantes fuera de clase, el tipo sabe mucho. 
En lo personal, varias veces me acerqué con dudas y e respondió de forma respetuosa, y buscando ejemplos que me permitieran entender ...Leer más...: Crítico, buen profesor, culto, justo, : No es puntual",4.9
60,": Se abordan todos los temas del programa.
En cada clase se realiza un ejercicio para afianzar el conocimiento.",4.5
61,": Explica bien en clases. Deja llegar tarde, ayuda.: Parciales según lo que recuerde. Califica muy tacañamente",3.7
62,La clase fue muy floja. Falto al menos a 7 sesiones,2.0
63,Amplio conocimiento y visión crítica : Buenas bases para investigar y desarrolla temas organizadamente : Requiere dedicación y profundizar en lo temas.,5.0
64,"Excelente  profesora, un poco escuelera pero se nota la gran preparación y empeño en sus clases",5.0
65,"Excelente profesor. Es muy atento a la asistencia (porque hace quices), si se estudia es facil y hace muchas dinamicas para la clase",4.6
66,"Muy buena explicando, es muy madre, si se pone atención y se hacen los talleres a conciencia la materia sale fácil.",4.0
67,": claudia es buena docente, intenta explicar a profundidad los temas relacionados con Contabilidad y ciertos tratamientos contables especificos
le puedes preguntar y no se enoja, te responde de buena manera 
hace lo posible por que entiendas los temas propuestos en clase
si demuestras interés pero sacas malas notas, busca la manera de ayudarte : le molesta la mediocridad de sus estudiantes (algo normal)",4.0
68,"La profesora Claudia es una excelente profesora en mi opinión, con ella vi Fundamentos de contabilidad financiera en primer semestre y me parece que logro cubrir de una muy buena manera todos los temas del curso y nos dejo bien preparados para los siguientes semestres. En cuando a su calificación saca las notas de 3 parciales los cuales no tienen m...Leer más...: Es chistosa 
Ayuda a los que van mal
",5.0
69,": Explica bien los temas, ayuda mucho: Exige bastante",4.0
70,"Es muy buena profesora, suele ayudar a los estudiantes que no les va muy bien y tiene consideración con las notas de monitoría. En el momento que la vi, dio bonos para el parcial final y eso ayudó a que muchos lo pasáramos.",5.0
71,"Buena profe. Le gusta el tema y le molesta a los que no ponen atencion, claramente. El monitor era un fastidio. No me fui bien porque no me gusta el tema.: Buena profe: Calificaciones un poco dificiles",3.8
72,"Es un profesor muy exigente. Se nota que conoce los temas como la palma de su mano, explica muy bien y siempre está abierto a que le hagan preguntas para explicarlas. : Muy puntual. 
Demasiado organizado. 
Conoce bastante bien los temas a enseñar. 
Tiene una argumentación muy sólida. : Demasiada cáscara en parciales. 
No da ni una sola oportunidad. U",5.0
73,"German es un gran profesor, pues se esfuerza por explicar cada uno de los temas de forma clara y completa. Propone ejemplos claros y a veces complejos para poder entender mejor los temás.: -Explica con diapositivas muy completas. que luego comparte para estudio autonomo.
-Explica muy bien los temas.
-Es ordenado y cumplido.
-Se preocupa principalmente por los registros contables.: -No da oportunidades.
-En los parciales tiende a colocar muchas cascaras.
",4.0
74,"Germán es un gran docente, argumenta muy bien, tiene gran dominio del tema. Se puede aprender mucho de él. Su clase es muy buena. Usa diapositivas con los conceptos básicos del tema y él posteriormente se encarga de explicarlos. Es exigente. : Es respetuoso.
Es organizado. 
Es puntual. 
Su clase es entretenida, hace chistes relacionados con la materia.
Si no entendió muy bien un tema, siempre está dispuesto a volver a explicar. 
Se aprende MUCHO con él
: Los exámenes alternan entre semifaciles y energúmenos. Muchas cáscaras y trampas que ponen a prueba la pericia y la astucia. ",5.0
75,"Es mal docente, no respeta los horarios, da informacion y saca notas importantes a través de aplicaciónes y redes sociales de manera que son pocos los que se enteran de los talleres (solo los que estén pendientes y tengan acceso a internet) Deja parciales de muchas operaciones pidiendo hoja de trabajo y estados en menos de una hora (nadie terminó e...Leer más...",1.0
76,"El profesor hace énfasis en historia de Colombia, historia del mundo, filosofía, antropología, sociología y temas que no se tocan en una carrera como Administración de Empresas pero que tienen relación, por lo tanto me parece que es una excelente introducción para un estudiante recién egresado de bachillerato y para los que han dejado los estudios ...Leer más...: El  profesor sabe acerca muchos temas y hace la clase muy amena. Es un ser humano excepcional.  : Para quien solo quiere ver temas relacionados con Administración de las organizaciones y no más, es mejor que no vea la materia con este profesor",4.8
77,": Tiene mucho conocimiento.
Explica bien, genera interes y empatía con los estudiantes.: Se desvía del tema, sus parciales son de las lecturas y. No de lo que habla en clase
",4.3
78,: las lecturas son cheveres,4.0
79,"Aunque el profesor es una persona que conoce mucho sobre historia, tiende a perderse en los temas que se deberían tratar directamente en la asignatura. En mi caso fue muy poco lo que aprendí realmente de fundamentos de administración, pues la clase fue más de repaso historico de Colombia que del enfoque en la historia de la administración.: -Explica muy bien por medio de mapas conceptuales.
-Intenta que sus clases sean amenas para los estudiante: -Se distrae facilmente.
-Los temas que explica tienden a desenfocarse de los fundamentos de administración.
-Los parciales son literalmente las lecturas al pie de la letra.
-Las lecturas ni complementan lo que expone en clase, ni se enfocan en los temas que se deben tratar.",3.5
80,"sabe mucho, el problema es que es bastante perezoso y fresco a la hora de dar sus clases. Repite mucho un discurso que aplica tanto a los temas que sabe como a los que no. Sus parciales son principalmente de lecturas. No me parece un buen profesor.",1.5
81,": Demuestra amplio conocimiento de los temas abordados.
Se ve el programa del curso en su totalidad.
Relaciona los tópicos del curso con la actualidad colombiana.
Los parciales no son complejos y se componen de lo visto en clase.: La metodología de evaluación varia en el transcurso del semestre.
",4.6
82,"El profesor demuestra en las clases conocimiento y dominio del tema. La exposición de los contenidos mediante ejemplos cotidianos y cercanos a la realidad colombiana, así como su buen sentido del humor, son un elemento atractivo de sus clases. Por otro lado, suele faltar a clase y en ocasiones las sesiones son muy breves y parecen no estar del todo...Leer más...: -Organización en la entrega de notas
-Buen acompañamiento de la monitoría
-Discusión de problemáticas actuales relacionadas con el curso.
-Parciales no complicados
: -Inasistencia frecuente(pérdida de clase)
-En ocasiones, insuficiente preparación de la clase.",4.0
83,"Uno de los peores profesores que he tenido en la carrera. Dudo de la calidad académica de la facultad cuando este tipo de docentes tienen a su cargo materias indispensables de la carrera como lo es el curso de Control Interno.: Muy fácil de aprobar
Intenta responder dudas: Extremadamente impuntual al punto de llegar 50 minutos tarde a clase.
No se aprende mucho sobre control interno.
No respeta el cronograma que plantea inicialmente.
El material de estudio lo entrega con poco tiempo de antelación antes de las evaluaciones.
Es muy disperso en clase, lo cual se traduce en una repetición innecesaria de ejemplos y conceptos teóricos.",1.5
84,"Es la mejor profesora del programa de administración. Sus clases son muy interesantes, sabe llamar la atención del estudiante para que participe y sea activo en la materia. : Parciales fáciles. 
Trabajos fáciles. 
Retroalimentación todas las clases. ",4.9
85,"Excelente profesora, se entiende lo que explica y siempre hace retro alimentación de lo visto, los parciales no son complicados",5.0
86,: Envía las diapositivas de la clase: La clase se puede hacer algo tediosa,4.5
87,"Muy buen profesora, explica muy bien ,envía diapositivas con las cuales se estudia, al inicio de cada clase repasa lo visto en la anterior.: Excelente docente.: Nada",4.7
88,"Muy buena docente, los temas son explicados de la mejor forma y se dan a entender en su totalidad.",4.5
89,"Me atrevería a decir que es la mejor profesora del programa de administración, entiende cómo se debe enseñar, y la manera de calificar, los contenidos son interactivos y se refuerzan a través de talleres y exposiciones.: Todo",5.0
90,": Realiza un resumen de la clase pasada
Los parciales son fáciles y los califica rápido 
Utiliza bastantes ejemplos para explicar los temas 
 : Llega tarde a clase",4.0
91,": Es amable
Explica bien
Es muy, MUY fácil de pasar: Es impuntual",4.3
92,"Es muy buen profesor, siempre repasa lo visto en las sesiones anteriores, los parciales son muy fáciles, solo basta con prestar atención en la case.",5.0
93,"Es una materia bastante sencilla tanto por la dificultad para conseguir buenas notas como en el nivel de estudio autonomo, creería que lo fundamental del curso quedó  claro, la metodología del curso, almenos en los bloques de 4 horas es sencilla, el profesor  tiende a llegar tarde a clases (10-20 min), ademas como en la mayoría de estos bloques da ...Leer más...: nivel de exigencia bajo y la nota final depende 100% de parciales este ultimo es  tanto positivo como negativo  ya que la dificultad de los mismos no es muy alta """", no obstante no deja de ser alarmante depender de unas cuantas preguntas para la nota final.: ""monotonía  de las clases"" y la nota final depende 100% es alarmante depender de unas cuantas preguntas (5-15 por parcial) para la nota final.",4.0
94,"El profesor llega tarde, da la clase a la carrera y cuando ha finalizado, de repente se va sin decir nada ni despedirse. La primera clase todos nos quedamos esperando porque pensamos que había salido a atender una llamada. En general se aprende mucho y los parciales son fáciles.: Es muy acelerado y a veces se le sale lo mala gente.",3.0
95,"ENGENERAL ES UN BUEN PROFESOR, SE ESMERA POR ENSEÑARTE BIEN: Llega tarde SIEMPRE",4.2
96,Es un poco aburrida la clase apesar del conocimiento que posee el.profesor y  que se nota,4.2
97,"Excelente profesora, explica bien los temas, es puntual, concisa y siempre dispuesta a resolver dudad.",5.0
98,Explica todos los temas del programa de una manera muy fácil de entender. Los parciales son sencillos.: Parciales fáciles: No profundiza en algunos temas,5.0
