,Review,Calification
1242,"Explicando es enredado, pero es buena gente. En laboratorio es muy bueno, y califica suave. En magistral sus parciales son de ejerciciso que ya sube a la plataforma que maneja. Se pasa facil, aunque eso es recientemente, antes solia ser caotico pasar con él.: Buena gente
Laboratorio
Atiende muy bien dudas en la oficina: Enseña mal",4.1
1243,"Es un profesor con una metodología de clase peculiar, tiene dominio del tema y deja una pagina web para resolver ejercicios y de allí saca los parciales. 
En el laboratorio siempre entrega una guía en donde toca entregar una parte en clase y el resto del informe en la siguiente sesión. Es un poco exigente al calificar laboratorios.
Requiere estudio autónomo: Con que haga los ejercicios que el profesor deja en la pagina web, los parciales serán sencillos porque los saca de ahí: Se enreda explicando
",3.2
1244,"No explica muy bien, deja repasos online de los cuales saca los parciales en su mayoría, hace clases de repaso donde pone ejercicios que pueden salir en el parcial, parciales muy conceptuales, por lo que pueden ser muy fáciles o difíciles dependiendo de que se le facilite a ud. Si se hacen todos los repasos le sube hasta 4 decimas en la definitiva al final.: Si se hacen los repasos y talleres que deja se pasa fácil.: No explica muy bien.",2.8
1245,En laboratorio fue excelente.,4.0
1246,"Es lo peor que hay para escoger en fundamentos de mecanica, sus parciales son sacados de una pagina en donde deja talleres, asi que es muy facil tener buena nota en estos. Pero su metodologia es de lo peor no explica nada y se me hace que esta rayado de la cabeza.: Parciales extremadamente faciles: No se aprende nada",1.5
1247,"Mal profesor, sus evaluaciones no son acordes con lo que explica en clase.
ademas que tiene una metodología de enseñanza pesima, no hace sino hablar consigomismo: ninguno: mala metodología de enseñanza",1.5
1248,"Sus parciales son muy difíciles, en clase solo nos pone a ver vídeos introductorios y sus explicaciones no son muy claras, pero es muy amable y gracioso.",3.0
1249,"Excelente profesor, se nota que ama lo que hace, hace un curso de la materia online en la que sube las clases y hace talleres no evaluables para el estudio en casa, los parciales salen de estos talleres, hace quices online bastante trabajables, realmente el prefesor da muchos chances. Aparte al final de semestre, verifica si se realizaron los talle...Leer más...: Excelente profesor",5.0
1250,"Terrible profesor, no sabe una mondá. Yo creo que conmigo pasando al frente a leer el Serway la gente entiende mejor. No debería contar como profesor.: -Llevo 2 minutos pensando pero no se me ocurre nada xD: -No sabe explicar
-Es mediocre
-Ir a clase es perder el tiempo
-No se aprende a menos de que estudie por su cuenta
-El man necesita un curso de power point, esas diapositivas son una mierda",1.5
1251,"Es un profesor que explica muy mal los temas, pasa las diapositivas rápidamente y avanza a mi parecer muy rápido los temas e impide que uno pueda estudiar y entender bien.
En la clase de taller hace un resumen de tema y deja ejercicios para entregar
Requiere demasiado estudio autónomo : Pone puntos adicionales en los parciales: Avanza muy rápido
No explica bien",1.5
1252,"Roberto es un profesor terrible, no sabe explicar y a juzgar por sus clases el dominio del tema es bastante pobre, sus clases son pasar las diapositivas y hacer ejercicios que en muchas ocasiones tienen errores, si quiere pasar la materia debe estudiar mucho por su cuenta ya que no explica en lo absoluto y en pocas ocasiones recibe reclamos de la n...Leer más...: Los parciales tienen 5 puntos
: Solo califica la respuesta
En taller se inventa las notas
Es muy desorganizado
Sus clases son tediosas e inútiles ",1.7
1253,"Es el peor profesor que he tenido en mi carrera. Explica muy mal, es muy desordenado, solo va a leer diapositivas y explica demasiado rápido, entonces nadie le entiende nada. En taller ni siquiera sabe qué notas está sacando a veces y cuando explica se equivoca y nunca manda la solución a esos problemas que plantea. La única ventaja es que si tiene...Leer más...: -Si es juicioso(a), la puede cinquear, pero le toca estudiar mucho
-Algunos parciales los califica sobre más de 5: -Explica muy mal
-Sus diapositivas son horribles
-Para pasar necesita sí o sí tener los parciales de semestres anteriores
-Se equivoca todo el tiempo
-No sabe utilizar el material audiovisual: tiene un videobeam y explica girando una cartuchera
-A veces su explicación es: ""porque sí""
-Va a quedar con muchos vacíos
-En los parciales solo califica la respuesta",1.5
1254,No sabe explicar : Todo: Nada,1.5
1255,"El peor profesor de la vida, va a leer diapositivas, no sabe nada, se confunde explicando todo, los parciales son largos y solo admite la respuesta, para pasar tiene que tener un buen grupo para la vopia: Ninguno: No aprende y se pierde fácil ",1.5
1256,"Es una buena profesora se preocupa por sus estudiantes, califica los laboratorios de acuerdo a lo que enseña, las calificaciones fueron muy buenas para todos los estudiantes, siempre estuvo abierta a ofrecer explicaciones a los estudiantes respecto a los temas del curso.
Dio las notas del curso siempre a tiempo y siempre ofrecio espacios para su revision: Buena profesora
Puntual
Califica lo que enseña",4.0
1257,"La metodología de esta clase está diseñada para que los estudiantes preparen la teoría antes de llegar al laboratorio y esto hace que uno pueda aprovechar mucho más la clase. Me gusta mucho que el es consciente de que solo aquel quién entiende bien el tema es capaz de explicarlo en palabras simples, algo que se me hace importante recordar como profesional : Mucha experiencia en este curso",3.9
1258,"Bienvenidos al mundo de la eterna revista, el dr se caracteriza por la lentitud de su revista, aunque a su favor es que explica bastante bien , sin embargo burlase  de la ignorancia de sus estudiantes a veces lo hace pasar por tosco, un profesor debe incentivar el amor por su materia, no permitir que ninguno de sus estudiantes sea depordebajeado po...Leer más...: Explica a profundidad en sus revistas clínicas. Te hace reflexionar sobre tus dudas.: Si no sabes algo saca comentarios sarcásticos y risas , no muy frecuentemente, aunque esto no es tan malo, pero si cuando deja que un residente lo coja de habito y humille a sus estudiantes",3.0
1259,"En pregrado se encuentran con el los afortunados que pueden ver Neurología, no sé si ya habrán cambiado el sistema pero no todos podían rotar en esta area. El contacto con el dr es escaso durante la rotación, explica de manera muy concreta y hace preguntas, pero como estudiante puedes pasar desapercibido, los internos y residentes tienen un poco má...Leer más...: es un duro en su especialidad: no comparte bien lo que sabe a los estudiantes de pregrado cursano neurologia en el semestre de medicina interna, no se esfuerza en inspirar a sus estudiantes, en contraste con la mayoría de los profesores de la  facultad de medicina de la nacional. Quizás si sea más académico y apasionado por su tema en su electiva pero ignoro del tema",3.0
1260,"ES LA MEJOR PROFESORA, jaja bueno es una de las mejores con las que tuve la fortuna de rotar, especialista en infectología, la dra Cuervo es una de las pedagogas de la facultad, el y su esposo se esfuerzan por inspirar pasión por el aprendizaje, sencillamente aprendes mucho con ella en tan corto tiempo, se esfuerza por dejarte una huella y amor por...Leer más...: te da nemotecnias , guias,tips, te enseña a amar la infectología. : muy poco tiempo se rota con ella. Pero esto no es problema de ella sino del departamento.",5.0
1261,"Es un excelente ser humano, con un conocimiento de la infectología profundo, una gran docente clínica y con un profundo amor por la semiología clásica, los nuevos métodos diagnósticos y los avances en microbiología e infectología. ",5.0
1262,"La Dra Valero es una persona comprometida con la enseñanza, tiene muy buena energia y es muy recursiva. Siempre esta buscando la participacion de sus estudiantes. Valoro mucho su manera de tomar las notas porque uno se da cuenta que l9 de menos es eso, es decir se da cuenta que vale mas lo que uno aprende y como lo aplica en la vida real. Es un pro...Leer más...: Aplicacion de los contenidos enseñados a situaciones reales: En ocasiones no es claro el curso de la progamacion. Se salta o adelanta temas.",4.9
1263,"Es una profesora dedicada, se vio por parte de ella un interes en mediar los problemas encontrados en el desarrollo logistico de la materia, asi como la busqueda de conciliacion con los estudiantes que no estaban conformes con las soluciones propuestas, siempre estuvo disponible para hablar sobre los problemas de la materia. El desarrollo de la materia a cargo de la profesora fue normal.: Abierta a resolver dudas y problemas con la materia: Casi nunca estaba presente en clase, siempre toco buscarla extraclase",4.0
1264,Explica de una manera tediosa y es un poco desorganizado con los tiempos ,3.2
1265,"Los términos y teoría económica los maneja muy bien desde la parte de socióloga, vale la pena...: -Se esmera bastante en incluir material y en sus clases
-Puntual: -Comentarios y forma de hablar algo golpeada pero se acostumbra ",4.7
1266,"La materia ha ido mejorando y actualizando, se empezó a manejar el programa ERDAS que es una ventaja para lo que se viene en el futuro a la geografía, eso si como todo con Triana es de estar presente en todas las clases y presentarle todo.: -Se ha estado actualizando el programa: -habla de una salida de campo que nunca hace
",4.7
1267,"La materia es exigente, es ya una costumbre que coja a un estudiante entre ojos sobre todo cuando no le asisten a las clases por salidas de campo que se crucen con la materia, se aprende bastante pero califica duro.: Puntual 
: -Temperamental 
-tiene preferencias (en las calificaciones)
-notas por debajo de 4 (en promedio)
",4.5
1268,: Sus clases son dinámicas y uno aprende mucho ,3.9
1269,Sus clases se aprovechan mucho. Deja mucha lectura pero toda vale la pena. ,3.9
1270,"Solo lee los slides y no sabe casi nada de Geomorfología. Desafortunadamente, es así con toda la Geografía Física del Departamento. Terrible y sin Geógrafos!",1.5
1271,"La clase demanda mucho tiempo, en una tarea uno se puede demorar 8 horas  fácilmente, sin embargo uno aprende mucho. ",3.6
1272,La clase es muy densa pero se le saca bastante provecho.,4.9
1273,Una persona extremamente arrogante y torpe! Imposible cualquier diálogo o solicitud para sanar dudas. Siempre tenemos que recorrer a sus pupilos que también son muy arrogantes.: Absolutamente nada,2.0
1274,"Excelente docente, domina completamente los temas de la clase y tiene buenas dinámicas de grupo.: Dominio del tema
Clases amenas",5.0
1275,"Sus clases son aburridas y planas. A veces insulta si uno no piensa igual a él. Se remite a leer diapositivas. Durante 4 clases seguidas leyó la misma diapositiva la cual tenía 3 párrafos. Cómo académico puede ser bueno pero le falta método y carisma en sus clases. : Dicta materias muy interesantes de gran importancia para nuestra formación. Conoce la importancia de las salidas de campo. : Se deja llevar por sus sentimientos, juzga, no es objetivo respecto a sus estudiantes. ",3.1
1276,"Excelente profesor, tiene paciencia, atiende fuera de la clases, mantiene informado a los estudiantes de como van en la materia, es exigente y puede parecer que es dificil la materia pero en realidad es muy fácil pasarla si eres responsable.: Es muy organizado con los trabajos y las calificaciones 
Explica los temas minuciosamente
Toma muchas notas y da oportunidades 

",4.8
1277,"Es un excelente docente, se toma muy en serio la parte de ser un profesor el cual esta dispuesto a brindar todo su conocimiento si así se lo exigen los estudiantes, motiva a ir mas allá del tres para aprobar, es llevarse unas buenas bases para el resto de la carrera y vida profesional.: Explica muy bien, es organizado, meticuloso y sus clases van mas allá de leer dispositivas es hacer que se comprenda claramente todo lo que requiere en la asignatura",4.9
1278,: Motiva a superarse,5.0
1279,"La materia es movida y exigente, se aprende bastante pero tiene sus días pailas y comentarios zafados: -Maneja bien el tema 
-tiene experiencia en el tema político y de conflicto colombiano: 
",4.0
1280,: Dice comentarios machistas repetidamente durante sus clases. ,3.4
1281,": -Mucha experiencia en el tema
-La salida de campo : -habla muy pasito 
-la edad ya le pesa ",4.5
1282,": Sabe un montón, las cátedras son muy buenas : Ya la edad lo afecta un poco, antes daba todo de el",4.2
1283,"Ya la edad le pega duro, tiene mucha experiencia por dirigir el ICA, en economía y tal, pero las clases son bastante aburridas y se aprende poco, por lo menos manejando la temática ambiental.: -Experiencia: -no hay control de llegada, la gente llega a la hora que quiere 
-poca motivación
-solo lectura de diapositivas ",3.0
1284,"De los peores profesores con los que me he topado en la Universidad.
En nuestra época, la clase se había vuelto un espacio en el que tocaba oírlo hablar y denigrar de distintas situaciones que afectaban a la Universidad o a la ciudad, de su ideología política y sus creencias religiosas.
Y cuidado con llevarle la contraria. A veces se hacía el bobo ...Leer más...: No le rescato nada.: -Intolerante
-Machista
-Irrespetuoso
-Atrevido
etc",1.5
1285,"Las clases son aburridas y se tratan de escuchar las opiniones del profesor, las lecturas durante el curso son pocas teniendo en cuenta la cantidad de tema que se debería manejar en el programa del curso. : Tiene tintes políticos u religios. No es exigente. ",2.0
1286,"Es un desastre su clase, no se aprende nada y con seguridad se queda mal preparado pues ni siquiera deja lecturas para avanzar en algo. Es demasiado agresivo y grosero con los expositores, no deja terminar ni lo qu se va a decir cuando ya lo está atacando. Probablemente el peor profesor que he tenido.",1.6
1287,"Perdida de tiempo y de créditos, sobre todo en materias tan fundamentales, NO INSCRIBIR EN LO POSIBLE CON EL !!

PDA: una vez se durmió en la expo de una compañera  :I: -Cristiano radical
-Perezoso
-In puntual
-poca vocación",1.5
1288,"Muy desordenado, no prepara las clases: No lo haga, compa",2.0
1289,"Excelente docente, apasionado por el curso y abierto a dar variados puntos de vista sobre los temas de las sesiones.: Clases a la calle : bastantes lecturas y muy extensas
",4.7
1290,"Aunque podría llegar a decirse que es un muy buen profesor con amplio conocimiento sobre el tema que enseña, como persona deja mucho que desear. Varios años seguidos se han reportado casos de acoso a las estudiantes por parte de este señor y comportamientos bastante extraños a través de redes sociales hacia sus estudiantes. ",3.0
1291,"Jorge Gamboa, es profesor de la asignatura ""America I""

Su metodología está enfocada a un contenido precolonial, comenzando superficialmente por Norte América, pero profundizando lo mejor posible en Sur América, se explican diversos temas, como culturas, función de la sociedad, arquitectura y arte. A pesar de tener el pequeño vacío conceptual de No...Leer más...",4.0
1292,"Su clase es aburrida porque no maneja buenas técnicas. Sabe del tema y es sencilla la clase. : Sabe muchísimo del tema y explica las cosas de forma sencilla
excelente escritor, no pierdan oportunidad de leer cualquier cosa de su autoría : Habla muy bajito y no maneja una buena técnica pedagógica ",3.5
1293,"Pablo Rodríguez, varias materias del departamento de Historia.

Es un excelente profesor, hace uso de contenidos multimedia para dictar sus clases. Se preocupa por hacer entender los contenidos de la clase.

Facilita material bibliográfico impreso a los estudiantes, y por lo general, organiza salidas a museos y sitios de interés cultural.",4.5
1294,"El profesor Archila es un experto en movimientos sociales del siglo XX, por lo cual constantemente este aspecto está presente en las clases magistrales. Por otra parte, las lecturas son muy variadas y todas ellas permiten tener un buen acervo historiográfico para comprender a grandes rasgos la primera mitad del siglo XX en Colombia. La materia se c...Leer más...: Excelente profesor.
Es gracioso.
Es exigente con cosas como la puntualidad y la asistencia a las clases.
Realiza salida de campo.
: Debería modificar la forma de socializar las reseñas. Esa dinámica de competencia ya está mandada a recoger.
Debería dividirse la calificación de las reseñas con el monitor.",5.0
1295,"Es una eminencia. Su materia se puede pasar fácilmente si se hacen las lecturas respectivas. Hay que ser organizado con los tiempos: Cada dos semanas se debe entregar una reseña sobre un libro leído. Ojalá llegar a clase con muchas preguntas, el profe sabe mucho.: Cuando el monitor hace la socialización de los libros no se aprende tanto como cuando las hace el profe Archila y llega a volverse tedioso.",4.5
1296,"Roch Little, profesor de distintas asignaturas del departamento de Historia.

Es un excelente maestro y está a la vanguardia de la utilización de contenidos poco ortodoxos para sus clases. Utiliza contenidos multimedia para facilitar la clase. Tiene un excelente manejo del español.

Conoce muy bien los temas que trata en sus clases.

Su metodología de calificación es flexible y justa. ",4.0
1297,Sabe mucho del tema y si le dan cuerda se extiende.: Muy atenta y dispuesta a resolver dudas: Parece que prepara solo la mitad de la clase si no participan. ,3.8
1298,No preparó la clase nunca. Menos mal no volverá a darla.: Desordenada,2.5
1299,"Como investigador, es excelso, pero debido a su avanzada edad y a la materia es cuestión, su cátedra es sumamente aburrida. : Su conocimiento : Aburrido ",4.4
1300,"Oscar Rodríguez es de los mejores profesores que se puede encontrar en el departamento, lo recomiendo completamente a quienes deseen aprender sobre historia económica de Colombia. Cuenta con una variada formación académica en ciencias humanas y económicas, por lo que todo se ve reflejado en los conocimientos que imparte, haciendo que se dé una form...Leer más...: Toca a profundidad todos los temas.
Maneja un componente teórico desde las escuelas económicas e históricas muy bueno.
Lo mantiene a uno atento tomando apuntes.
: El programa se puede desfazar un poco debido a contratiempos como asambleas y demás. Sin embargo, las lecturas hay que seguirlas porque de todas maneras entran en los parciales.
Tiene algo de favoritismo por los que son de Historia.",5.0
1301,"De los mejores profesores del departamento, realmente le pone empeño a sus clases y las hace interesantes.: Es muy amable y se esfuerza por hacer las clases algo agradable 
Se aprende: No da descanso y la clase dura tres horas
Algunas civilizaciones quedan por fuera porque se extiende mucho con las primeras",4.5
1302,"Dicta varias materias dentro del departamento de Historia. Es uno de los pocos historiadores colombianos especializado en historia antigua, por lo cual es prácticamente el único que dicta Antigua I y ocasionalmente Antigua II. Hay que tener en cuenta que no se puede profundizar mucho en los temas puesto que el periodo de estudio es muy amplio.

El ...Leer más...: Es experto en el tema.
Entiende que es una materia para primíparos, por lo cual no es muy estricto.
Promueve el pensamiento crítico para entender los conflictos actuales en el Medio Oriente a partir del curso.
: No hace receso durante las tres horas de clase.
tantemente se pasa varios minutos más del final de la clase.
De vez en cuando se le salen comentarios muy rojos.
tantemente lanza pullas al cristianismo.",4.3
1303,"Excelente docente, aveces las clases se vuelven un poco densas debido a la cantidad de información, el docente se encarga de hacer a la clase amena y entretenida.: Excelente docente: Un poco desorganizado con las notas",4.7
1304,"Darío Campos, varias materias del departamento de Historia.

Sus clases suelen extenderse mas del tiempo estipulado, se preocupa por profundizar en los temas que expone. Realiza distintos trabajos que hacen flexibilizar la materia y expandirla hacia otros campos como las artes o la literatura.

Su forma de calificación es muy flexible.",4.5
1305,"Es un muy buen profesor con amplio conocimiento sobre su área de estudio. Se debe llegar a cada clase con las lecturas correspondientes listas, de esta manera se hace un ejercicio más ameno. Los métodos de calificación son trabajos específicos, generalmente de ejercicios investigativos que proveen experiencia en este campo tan necesario. : Propicia la discusión en clase y el diálogo con el profe es bastante fácil. ",4.5
1306,"Es el profesor con le que le cogí aprecio al a carrera. Es nuy buen docente y explica muy bien los temas. Además, se interea mucho porque los estudiantes aprendan. Califica muy justamente.: Aclara bien las dudas",5.0
1307,"Es un buen profesor, y se nota que tiene muchísimos conocimientos muy valiosos, pero en realidad me parece que se desperdicia todo eso en la materia. Él explica los pasos a seguir para la realización conceptual de un proceso en ing. química, pero casi que solo repite lo que está en su libro. Si bien es cierto dice cosas muy interesantes que no apar...Leer más...: Sabe de muchas cosas
Comprometido",4.5
1308,"Muy buen profesor, domina los temas que maneja y crea en los estudiantes un pensamiento critico, propio de  un ingeniero.: Conoce bien los temas que enseña.: Suele ser petulante y despectivo con sus comentarios.",4.0
1309,"uno de los mejores profesores que he tenido sin duda, explica muy bien los temas ",5.0
1310,"Este profesor ofrece explicaciones apropiadas y claras. Cuando existen dudas, resuelve, pero supone a veces que los alumnos están en entendimiento para realizar las consultas. Se apega al libro guía para la explicación. Desarrolla quiz durante los primeros diez (10:00) minutos de algunas lecciones, cuyo contenido también provienen del mismo libro g...Leer más...: Da buenas y amplias explicaciones.: No es muy paciente.",3.0
1311,"En realidad sabe mucho, he aprendido mucho pero es un hp petulante y creído, que cree que por saber mucho puede humillar a los estudiantes.: Se aprende muchisimo: Cree que sólo vemos su materia en elsemestre",1.6
1312,": Buen profesor.
Domina los temas que enseña: A veces suele ser un poco petulante",3.5
1313,: Explica bastante bien: Califica muy duro y en las sustentaciones hace que las personas se sientan mal ,4.0
1314,"El profesor no explica muy bien, y los temas que explica no son todos. No aprendí mucho la verdad. La mitad del semestre vimos casi que solo conversiones y en la otra mitad sí lo que se ven en la materia, pero muy por encima porque claramente no alcanzaba el tiempo. El trabajo en clase era importante, y en los mismos grupos de 3 personas, pero los ...Leer más...: No enseña todos los temas
Lo que enseña, es por encima",2.5
1315,Explica todo muy por encima y todo lo saca de un libro.: Le responde muy feo a los estudiantes.,3.0
1316,"debería ser mas dinámico en las clases, cuando vi la materia dejo los temas muy por encima, inclusive no concluimos con todo el programa propuesto: se limita a leer las diapositivas que lleva a clase",2.5
1317,"De los profesores más malos que he tenido. No explica bien los temas, deja vacios conceptuales inmenso, sus parciales son tediosos, no le apasiona lo que hace.",2.5
1318,"Belalcazar es el mas fácil, las clases son solo diapositivas y hacer unos trabajos que no mira nunca, no se aprende mucho aparte que uno estudie por su cuenta y hay muchas personas que se confían y la pierden ",2.9
1319,"No es muy buen profesor, sus clases son aburridas y no se aprende mucho , da muchas ayudas aunque sus parciales no son tan fáciles",2.0
1320,"No explica mal, pero es muy escuelero, aunque da muchas oportunidades para pasar y sus talleres valen lo mismo que un parcial y son extremadamente faciles, los ejercicios del parcial los toma de alguno de los 3 libros por lo que si los practica la pasa alta (gooding, felder o reklaitis)",3.5
1321,"Realiza la clase un poco amena, enseña lo necesario, no es difícil ver una materia con él, igual le falta esforzarse un poco para enseñar diferentes cosas ",3.5
1322,"Es un profesor que intenta explicar los temas muy minuciosamente pero a veces se desvía mucho del tema principal y termina dejando incompletos la mayoría de ellos.
Usualmente es mejor ir estudiando autónomamente para llegar preparado a los parciales que son de un nivel mucho mayor a lo que explica.
Pero él está dispuesto a resolver dudas en horario extra clase ",2.4
1323,"Dado que Fluidos (2015714) es una asignatura que decidió impartirse modularmente, los dos (2) primeros módulos fueron ofrecidos por el colega Jorge Manrique —más a este respecto en la reseña— así que quien determina la calificación final es quien imparte los dos (2) últimos módulos. En el caso presente, fue el Prof. Nelson.

Emplea un lenguaje comp...Leer más...: Espectacular tono de voz y simpatía convenientes para las lecciones.
Es paciente.",4.5
1324,Trata de explicar todos los temas aunque no siempre se abarcan a profundidad. A veces divaga en clase y se desvía de lo realmente importante. Cuando se tiene una duda procura aclararla pero algunas veces se enreda. Como persona es un poco pedante.: Da oportunidades para pasar y ayuda mucho.: Si te coge de parche puede llegar a ser un pelmazo.,3.5
1325,"Me gustan muchos sus pantalones, son coloridos.

Es un profe muy buena onda, los parciales son acorde a lo que explica : Tiene mucho estilo.: Suda mucho.",1.5
