,Review,Calification
1795,"Una pésima docente, si bien se ve que sabe de la materia, y cualquier pregunta que se le plantea la puede resolver, no sabe enseñar. Si se quiere aprender con ella se necesita más tiempo del que realmente está asignado para la materia y contar con el tiempo para ir a las asesorías, dónde si enseña como se debe. 
En clase se va por las ramas, soluci...Leer más...: -Puntos de participación.
-Asesorías muy completas.: -Talleres extensos y complicados.
-No utiliza tablero, sólo diapositivas.
-Demasiados temas por clase. 
-Ejemplos muy sencillos en clase y parciales muy complejos para lo que se enseña.",2.0
1796,"Es buena explicando y siempre está dispuesta a resolver las dudas de los estudiantes, se aprende bien y lo necesario con ella; aunque depende mucho, demasiado, de las diapositivas. Cuando copia en el tablero es extremadamente desorganizada. Sus comentarios a la hora de calificar tienden a ser un poco agresivos, y hay ocasiones en que no es 100 % objetiva con la calificación.: Deja ejercicios para subir la nota de quices, se puede dejar alta esta nota.
Explica bien.
Tiempo para asesorías.: Suele llegar tarde.
Depende de las diapositivas.
Desorganizada.
Sus clases tienden a ser aburridas.
Se enreda cuando algún estudiante le pregunta algo en clase.",3.0
1797,"No sabe explicar tan bien. Califica demasiado mal (En un parcial y tres quizes tuve que reclamar porque ya que califico erróneamente, tanto así que al final me subió media unidad aprox en cada uno después del reclamo) Los parciales son largos y algo difíciles. Se apoya mucho de las diapositivas y no ""enseña"" realmente. Y no da nada de ayudas, absol...Leer más...",2.5
1798,"La profesora da tiempo para preguntarle en la oficina, parciales difíciles, pero quizzes para subir la nota de la materia.: Tiene buena disposición",4.3
1799,": 1. Quices trabajables: 1. Durante el curso se dedica a demostrar.
2. clase no muy amena.
3. talleres super largos
4. Parciales difíciles
5. Dicta los temas demasiado rápido
",1.5
1800,"Es una excelente profesora, sabe demasiado, explica bien aunque a veces va muy rápido (si uno le dice que vaya más lento lo hace), es muy comprensiva y da mucho tiempo para tutorias a parte con ella. Da bonos para quices y es fácil llegar a dejarlos en 5 lo cual ayuda bastante puesto que sus parciales si son difíciles. Si se hace los talleres compl...Leer más...: Comprensiva
Da bonos o tareas para que quices queden en 5
Califica en forma justa
Se aprende bastante: Parciales y quices complejos y largos
Talleres un poco extensos para estudiar",4.5
1801,"Explica bien los temas que corresponden porque se le nota que el gusta lo que hace, ademas usualmente está disponible para los estudiantes.: Explica muy bien.
Deja un buen de trabajo.
Cercana a los estudiantes.
Al final de curso deja como 1000 tareas para levantar nota.: Aunque no sea una contra del todo, no es para nada facil pasar.",5.0
1802,"No me gustó la manera como dicta la clase porque al usar diapositivas, no me parece que se de a entender muy bien. Sus parciales son bastante largos y muchos de los ejercicios que allí aparecen son casi los mismos que ella pone en los talleres. No es fácil pasar con ella, pero con estudio autónomo se puede pasar sin problema.  : -Está dispuesta a resolver todas las dudas que uno tenga en sus horarios de consulta: -Parciales largos
",3.0
1803,"Es muy paciente y explica muy bien los temas. Es muy amable ya que siempre está disponible para una asesoría. : Los parciales son sencillos, pero hay que prestar mucha atención a los detalles para no tirárselos.: Sus cursos siempre tienen sobrecupo. ",5.0
1804,"es una buena persona, pero realmente no parecio disfrutar mucho darnos clase, no se llevaba muy bien con los estudiantes y por eso terminaba afectando la clase, muchas cosas que nos eran dificiles o muy obvias no las deciamos y parecia estresarse
uno aprende a demostrar cuando los otros lo corrigen, y uno se asegura cuando nececita la nota, el trab...Leer más...: deja talleres de todos los temas, esos puntos saldran probablemente en los parciales
intenta acercar los temas abstractos con ideas mas cotidianas.
trae objetivos para cada clase
nos ayudo a pasar :'V
es buena persona: saca muy pocas notas, casi todo depende del parcial y en fundamentos puede salirle a uno caro.
parciales largos y exigentes
preguntas tan obvias que parecen cascaras, nadie responde
explica las cosas fáciles en clase y lo otro...
se enredo una que otra vez.
trabajos en grupo que no aportaban 
le falta empatia ya que su materia es un curso muy diferente a todo lo que uno espera",3.9
1805,"Ella en principio era amable y explicaba bien el curso, pero no sé qué le pasó. Yo creo que le caíamos mal, y muchos perdimos con notas bajísimas. En sus clases transmitía una cierta frustración, que la verdad arruinaba el ambiente del curso en general. 
Los talleres que asignaba no tenían mucho que ver con lo que evaluaba, y no se guiaba de un solo libro.: Intentaba explicar bien. : Era una persona frustrada. 
No se entendía lo que quería evaluar. 
A veces se enreda en clase.",2.5
1806,"Ivon es una persona muy inmadura, cree que sabe mucho pero no es capaz de hacer una demostración bien en clase, por lo cual la deja tarea, es muy probable que ella lea esto, así que lo único que le diré: por favor, si no ha conseguido algo mejor y ve que no puede dictar una clase mejor búsquese otra ocupación y no haga que todo un curso sienta su frustración.: Nada: 1. No prepara las clases.
2. No sabe demostrar.
3, No le gusta dictar clases.
4. solo presume que tiene un doctorado en álgebra.
5. Se la pasa diciendo que solo dicta clase porque no ha conseguido algo mejor.",1.5
1807,Parciales similar a los talleres. Se le entiende lo que explica. Califica justo. Un poco menos de la mitad del curso perdió la materia.,4.0
1808,"Buena profesora, asegurate de hacer todas las actividades del moodle, llegar temprano a clase y hacer los talleres de Martha Moreno",3.7
1809,"Ivon es buena profesora y la asignatura se puede dejar alta si se estudia como debe ser.: Explica muy bien los temas vistos en clase y atiende a las preguntas de los estudiantes.

Perdona pequeños errores, No es dura para calificar.

Envía bastantes talleres para trabajar fuera de clase de los cuales saca varios de los puntos para colocarlos en el parcial (o parecidos) .

El ultimo parcial lo califico sobre 6.0, el cual era el 30% de la nota definitiva.: Aveces se enoja un poco pero nada grave.",4.5
1810,"Es buena explicando, a veces es un poco aburridor, pero siempre busca aclarar todas las dudas, sus parciales son sencillos y justos. hace quices en moodle: Amabilidad
: un poco aburridoras las clases",4.3
1811,"Explica muy bien aunque a veces comete pequeños errores o se enreda explicando, pero retoma el tema y realmente se entiende; sin embargo, era porque al parecer era un de los primeros semestres que enseñaba. Los parciales están bien, no pone cosas complicadas. Realiza quices sencillos después de explicar algún tema. Exime del último parcial si los dos primeros están muy bien.
: Amable
Explica bien",4.3
1812,"Tome el curso de EDO con ella, cuando recién terminaba su Doctorado en ecuaciones diferenciales, fue una experiencia única. Ella tiene problemas aveces para dar las clases y uno se pierde, pero si uno le pregunta o le hace caer en cuenta, cubre los huecos y listo. Los parciales (cuatro o cinco), son fáciles y algunos son para la casa.: - Es una experta en el tema
- Las evaluaciones son fáciles
- Las experiencias de ella en su PhD, complementan bien el curso : - Se enreda dando temas
- Llega aveces tarde
- Se pierde en algunos temas como integración (Pero esto ya parece que lo soluciono) ",4.4
1813,Es un excelente profesor de los mejores de la universidad,5.0
1814,"Es un excelente profesor ya que en verdad le gusta lo que hace, y es muy práctico en las clases: Es fácil dejarla la alta
En verdad motiva: Puntualidad
No revisa bien los talleres",4.5
1815,"El profe es uno de los tipos más inteligentes que conozco, me leí su hoja de vida como 10 veces y no dejó de impresionarme. Sabe muchísmo de todo y es algo que transmite en las clases, inspiraba. 
Sin embargo, para el caso de cálculo diferencial, a veces se desviaba demasiado del tema y esto hizo que vieramos aplicaciones de derivadas, un tema impo...Leer más...: es un genio, es muy apasionado, es justo con la calificación: llega tarde, no sigue el programa, uno no practica muchos ejecicios. ",4.7
1816,": Explica muy bien
Solidario con las calificaciones
Justo
Clases dinámicas
Pone muchos ejemplos reales: Puntualidad
Algo sangron",4.2
1817,": Explica bastante bien, si tiene dudas se toma el tiempo para resolverlas, se enfoca bastante en hacer entender el concepto: puntualidad, no revisa bien los talleres",4.0
1818,"En general es un buen profesor, sin duda alguna le apasionan las matemáticas. Algunas veces se enfoca demasiado en las demostraciones y se enreda. Los ejercicios de los parciales no son muy complicados y es justo calificando.: Puntualidad",4.0
1819,"Al principio una se lleva la idea que ya valió madres. pero al final sale uno con una idea totalmente distinta, se pone en los zapatos del estudiante y da oportunidades con el examen supletorio. ayuda bastante.: Explica Muy bien
da parcial nivelatorio",5.0
1820,Es bastante bueno : Sabe bastante y se nota que le interesa que aprendamos: Va demasiado rápido y sus dibujos no se entienden aveces,4.0
1821,"Uno de los mejores profesores de la Universidad, repasa la temática de cursos anteriores, y deja supremamente preparado para el siguiente, tanto así q lo deja con la intriga de lo que va a ver el próximo semestre. : -Clase interesante.
-Explica teoría Básica y refuerza con ejercicios. : -Nada... ",5.0
1822,"Excelente profesor en todo el sentido: Explica muy bien los temas y de la mejor manera posible, le encanta que uno pregunte para dejar muy claros los temas, excelente persona y le da un muy buen ambiente a la clase: Nada!",4.4
1823,Es uno de los mejores profesores; su experiencia y su sencillez hacen que las clases sean muy provechosas.  Es muy justo con las evaluaciones.: Todo: Nada,5.0
1824,"Es un muy buen profesor, logra que uno se enganche al tema con su manera de explicarlo, el único problema serían sus dibujos, ya que eran pésimos y uno se confundía. Los parciales no eran fáciles pero resolvía bien las dudas y uno sabía el libro guía a usar (Marsden y Tromba), esto debido a que los parciales eran basados en los ejercicios propuesto...Leer más...: Dominio del tema.
Buena pedagogía
: Dibujos pésimos.
",4.4
1825,"De los mejores, demasiado claro al explicar los temas, así que me pesa no haber aprovechado sus clases. Es un paisa muy simpático, sus clases siempre están llenas de chistes y muy pedagógico en su metodología. Hace quices cada viernes, y son una nota que ayuda mucho al final. Cualquier materia con él la matricularía sin dudarlo. ",5.0
1826,"De nuevo, uno de los mejores profesores de la U. Vi ecuaciones diferenciales con él, después de haber visto integral también con él; y fue la mejor decisión. Es excepcional; tiene los temas super claros y también super claro el orden en el que los dicta. Todo lo relaciona con cosas de la vida laboral y cotidiana, y lo que siempre me ha parecido su ...Leer más...: Explica excelentísimo
Se asegura de que entiendas bien
Ejercicios para que practiques
Parciales justos
",5.0
1827,"Es uno de los mejores profesores que he tenido en mi vida, y creo que así va a ser siempre. Es excelente explicando, sorprendente... es muy ameno y divertido, las clases son súper entretenidas y siempre se preocupa porque los estudiantes aprendan; si es necesario, empieza a explicar de nuevo todo lo visto en clase, si le dices que no entiendes. Ati...Leer más...: Excelente profesor
Ameno y divertido
Siempre contesta las dudas
Parciales justos
Quices cada semana",5.0
1828,"Aunque perdí la materia con Herbert y ya tenia conocimientos previos tanto de lo que vi con él y colegio. Leonardo me mostro una nueva forma de abordar el cálculo diferencial que lleno todos mis vacíos conceptuales y lo mismo sucedió en álgebra lineal. El como da los temas lo incentiva a uno a ir puntual a clase. Las evaluaciones son de un nivel moderado. Lo recomiendo para cualquier curso: - Excelente pedagogía
- Abarca muy bien los temas
- Tiene anécdotas que lo ayudan a uno a entender  ",5.0
1829,"Es un buen profesor, aunque al principio cuesta cogerle el ritmo.Suele ser un poco arrogante en las clases.Califica la materia con 4 parciales con una complejidad un poco elevada, pero de seguro usted va a aprender: Se aprende con el 
No deja mucho trabajo 
: Califica resultados
Es un poco arrogante ",4.1
1830,"Es un profesor bastante complicado de descifrar. Cuando yo vi esta materia, dejaba lecturas de unas 15 paginas por semana y la forma de evaluación era la explicación la primera clase y quiz la segunda, pero con el tiempo se iban acumulando temas o quices y el aprendizaje era autónomo. Sin embargo, las lecturas correspondían a temas de materias de s...Leer más...: Tiempo para consulta.: Desorden en la clase.
Falta de claridad en los temas.
Subjetividad al evaluar.
",1.9
1831,"divaga bastante acerca de temas aleatorios, (aprendí bastante de otras cosas que de calculo).
es un poco arrogante a la hora de dictar clase, y un poco altanero al responder preguntas.
su forma de calificar es de cinco parciales haciendo aproximadamente uno cada dos semanas.
no es un mal profesor, es notable que sabe bastante y si se pone empeño en...Leer más...: se aprende de varios temas en general y tiene en cuenta la media del curso para así dar ayudas
los parciales pueden ser hasta sobre 65: divaga mucho en clase, responde de forma altanera ",3.0
1832,"Como profesor es muy arrogante, trata de ser bastante autoritario. Enseña los temas en el orden que él considera conveniente, en cálculo diferencial hacia exámenes cada dos semanas, me parecía un buen método y además no eran imposibles. Deja talleres que sirven para estudiar para esos exámenes ",4.1
1833,Es el peor profesor que he tenido en toda mi vida: Nada: Es arrogante. No resuelve dudas. En los parciales pregunta temas que aún no ha explicado.,1.5
1834,"Bastante buen profesor. No envia talleres excesivos y explica de manera concisa y practica los temas. : Para estudiantes que se les facilite el tema es ideal al no enviar casi talleres ni tareas obligatorias. : Le faltaron algunos temas especificos que pueden salir en parciales conjuntos.
Es dificil encontrarlo fuera de clase y no responde casi nada por correo.",4.5
1835,"No explica mucho en los temas, es aceptable el trabajo, pero no si uno quiere aprender de verdad.",2.8
1836,"En todas sus clases habla en un tono en el que es imposible escucharlo,deja tareas demasiado complicadas y no las recibe con un mínimo de tardanza.: No son tan difíciles los parciales : Los parciales son demostrativos",3.0
1837,"Pésimo docente, habla muy bajo, escribe muy pequeño, no explica bien y tras del hecho se molesta si uno respetuosamente le pide que hable más alto o que escriba más grande. No tiene el don de enseñanza y tras del hecho no le importa los estudiantes.: Es marica, creo que por eso habla tan bajo: Todo, puede que tenga mucha formación y títulos pero definitivamente docente no es.",1.5
1838,"Pésimo profesor, parece que se esté hablando a si mismo en las clases, no resuelve dudas, siempre responde cosas ambiguas, deja tareas realizables, pero si entrega la tarea un minuto tarde no la recibe, sus parciales son trabajables so hace las tareas a conciencia. Simplemente una persoba despreciable y un profesor regular.: Tareas fáciles : Todo jaja",1.5
1839,"Pésimo. No disfruta dar una clase;es arrogante,antipático, no se le puede hablar. Le pedí que me cambiara la nota de un parcial;nunca lo hizo, los parciales eso sí son culos.Si estudia por su cuenta no va a tener problemas para aprobar con él, pero no espere un profesor inspirador que motive a los estudiantes ni se esfuerce por explicar los temas c...Leer más...: A veces pone trabajos que resultan ser desafiantes pero se aprende de ellos: Casi todo",2.2
1840,"Lo que ya dijeron, pésimo para explicar, no se preocupa por el tono de voz, por escribir grande y si uno le pide que repita algo, que hable más alto, que repita, pone una cara de orto que a mí me daba una rabia la hpta. En las clases noté que hay veces que como que duda de lo que hace y empieza a hablar aún más abjito, cuando uno pide explicación d...Leer más...: Parciales culos
A veces da aplicaciones interesantes de los tópicos que trata: Cuando quiere joder por los parciales culos, jode y lo clava
Apático, engreído, arrogante, en absoluto sirve para profesor
Se confunde explicando
Bota los parciales y se lo toma como si fuera nada",1.5
1841,"Recomendado para aprender, deja tareas casi todas las semanas las cuales hay que entregar de forma puntual, pero son trabajables y ayudan a preparar los temas que entran en los parciales. Muchos ejercicios que aparecen en los parciales fueron antes resueltos en clase, por lo que es bueno prestar atención y tener buenos apuntes. : Se aprende mucho sobre la materia.
Parciales trabajables.: Quizá con tantas tareas pueda acaparar más tiempo de lo que debería.",4.5
1842,"El profe Agustín es excelente profe. Es justo y comprensivo cuando uno comp estudiante tiene dificultades.  es muy exigente en cuanto a la puntualidad de llegada a clase y entrega de trabajos. tiene mucho conocimiento, sin embargo a veces divaga en temas densos donde a veces queda uno perdido.: exigente y motiva al estudio de la Matemática",5.0
1843,"Puede ser arrogante y en general explica por encima las cosas, no es amable y le parecen bobas las preguntas que para él son obvias, tiene un amor por el álgebra y es apasionado por lo que hace: Es apasionado y le gusta mostrar ejemplos y aplicaciones: Es bastante odioso para explicar y habla muy suave",3.0
1844,Facil y buena gente aunque no se aprende mucho,3.0
1845,"A mí me pareció que no enseña lo suficiente. No profundiza demasiado, sólo escuetamente lo necesario para una ingeniería. : Parciales sencillos. : No profundiza en aplicaciones ni en conceptos. Asume que es intuitivo para todos. ",3.0
1846,"Es un buen profesor, sus parciales son bastante fáciles y explica bien. A veces se enreda un poco en clase, pero se nota que sabe del tema y hace que los estudiantes entiendan.: -Parciales fáciles",4.5
1847,no se aprende : no se aprende ,1.5
1848,"El profesor es bueno, no profundiza mucho en los temas pero explica lo necesario para ingenierías. Los parciales son trabajables, todo lo saca del Stewart. Si se estudia bien, la materia se puede dejar alta. También a veces ayuda con la nota dejando ejercicios extra.: Está atento a resolver dudas
Parciales justos: No profundiza mucho en los temas
A veces se enreda un poco
Se requiere bastante estudio autonomo para dejarla alta (pero pasar con él la materia es fácil)",4.0
1849,"el profesor es madre y califica lo justo, además evalúa lo que se vio en clase, a mi me gusto mucho la metodología. : parciales cortos",5.0
1850,"Muy buena metodología de enseñanza, aunque no deja talleres, explica los temas de forma concisa y tiene buena disposición para repetir la explicación si uno se pierde. Los parciales no son difíciles pero si requieren que se estudie bastante, es flexible a la hora de calificar y no es cascarero.: Excelente manera de enseñar.
Amabilidad y paciencia con el estudiante.: A veces se enreda en las explicaciones.
No deja talleres adicionales.",5.0
1851,"Calculo integral; Es buen profesor, siempre explica las dudas con buena disposicion y lleva las clases bien preparadas, los parciales no son muy complejos pero si requieren buen estudio, es buena persona. Lo unico negativo que le destaco es que aveces se enreda un poco explicando: aveces se enreda explicando",4.0
1852,"El profe me pareció ni muy, muy, ni tan, tan. Explica bien, pero no tanto; como cuando para ti algo es super hiper mega sencillo, y no hay mucho que explicar, pero sí, había cosas que eran confusas. Siempre manejó el mismo libro, y los quices eran bien sencillos, aunque en esa época, no sé si ahora también, los ponía en el mismo parcial. Los parcia...Leer más...: Es fácil: No deja trabajos ni ejercicios para practicar",3.8
1853,"Es un profesor muy muy facil, y la materia es muy muy facil, pase raspando porque falte casi que a la mitad de las clases, el profesor super recomendado, enseña bien y los parciales son simples, si estan repitiendo y necesitan salir rapido de la materia super recomendado este señor: califica suave
Parciales faciles
Enseña bien: Nada no hay no existe",5.0
1854,"El profesor es bueno, no me dedique mucho a la materia y por eso mi nota fue mala, me parece que es generoso calificando, el tercer parcial sólo lo hicimos los que teníamos nota por debajo de 3,7. Una vez se notaba que estaba enfermo pues estaba sudando pero esto no le impidió hacer su clase, usaba herramientas tecnológicas para hacer la clase en las aulas grandes del viejo ",4.1
1855,"Explica excelente, lo necesario y se aprende mucho.",5.0
1856,"No me parece una buena docente. 
Recalca la importancia de la materia y se nota el gusto por las matemáticas, pero no lo transmite de manera correcta. Los parciales son muy complejos, los talleres son extensos y no tiene horario de atención, por lo que todo lo tiene que solucionar el estudiante por su cuenta.
Pide los talleres en latex y me parece ...Leer más...: -Talleres largos y en latex. 
-Parciales complejos.
-Muchas demostraciones.",1.5
1857,"Es muy buena profesora, aprovecha muy bien la clase y se esfuerza porque sus estudiantes le cojan gusto a la materia, explica claro y conciso, es muy puntual, sus parciales son dificiles pero se pueden pasar si hace todos los talleres.: Explica muy bien
Buena gente
Puntual: Parciales para rajar gente
Es de 7am
",4.3
1858,"En cálculo multivariable se alocó exigiendo a lo loco y preguntando cosas que ni explico, nunca hizo siquiera una sesión de preguntas y tampoco contestaba correos ni nada : nada: todo no metan con ella ",1.5
1859,"No me gusto, vi algebra lineal y calculo vectorial con ella y la verdad no sali con buenas bases, sus talleres son excesivamente complejos y sus parciales también, cuando llegué a ecuaciones diferenciales tenia muchos vacios conceptuales debido a que es demasiado demostrativa y a veces no es muy clara: parciales y talleres dificiles ",1.5
1860,"Es amable y le encanta lo que hace, lo cual lo transmite a sus estudiantes, aunque es muy estricta y exigente con la puntualidad; que si se llega tarde así sean dos minutos uno llega ya perdido a la clase. Hay que llegar 5 min antes. : Explica bien, ilustra con ejemplos y aplicaciones interesantes.: Talleres muy largos y difíciles, de los cuales hace los parciales muy similares.",4.0
1861,": Ama las matemáticas y hace que los estudiantes le tomen gusto, esto hace que las clases sean muy amenas y que sus explicaciones sean excelentes.: Requiere bastante dedicación, ya que sus talleres son complejos.",4.0
1862,Es una buena profesora de los talleres que deja en clase saca los parciales y los quices y asi mismo responde dudas : Responde dudas y explica de manera sencilla: No regala nota ni ayuda en la mayoria de casos ,4.0
1863,"Profesora bastante complicada, le gusta hacer sustentaciones en grupo en donde de una sola persona depende la nota de los demas lo que me parece injusto.: Buena manera de explicar.: Parciales complicados, sustentaciones de grupo y quices sorpresas.",2.8
1864,"Ricardo explica muy bien el tema, es demasiado riguroso, prepara muy bien las clases y deja muy claro los temas vistos. El problema es que es demasiado exigente calificando y los puntos de sus parciales comen mucho tiempo resolviendolos, en dos horas casi no alcanzas. Hay que estudiar mucho y hacer todos los puntos de sus talleres.: Explica muy bien y resuelve dudas: Sus exámenes largos.",4.0
1865,"Muy buen profesor 
Quedan bases muy solidas, pero requiere mucha dedicación.
El único defecto sobresaliente es que llegó entre 10 y 30 minutos tarde a clase todo el semestre (Incluso en parciales).
: - Tiene mucha experiencia.
-  Da ejemplos muy prácticos.
- Envía talleres por cada tema trabajado.
- Tiene disposición a atender dudas y se deja hablar.: - Cuando se le salta la chispa es arrogante.
- Muy exigente calificando.",4.0
1866,": Muy profesional enseñando, bastante formal y quedan muy buenas bases con el.: Demasiado exigente en sus calificaciones",5.0
1867,"El profesor es muy bueno explicando pero es terrible calificando. Tienes que estudiar demasiado por tu cuenta para aprobar. Además, si el punto no está perfecto te puede quedar en 0. Es muy complicado aprobarle y las notas suelen ser muy bajas: Muy organizado
Explica muy bien: Califica horrible
Aveces tiene una actitud muy pedante para dar la clase y atender dudas.",2.0
1868,"Explica muy bien, pero pareciera que no deseara que sus estudiantes aprueben.
: Explica bien: Duro calificando",4.0
1869,"El profe es amable y es pilo, pero cuando veía clase con él llegaba media hora tarde incluidos los parciales. Hace quices opcionales para subir las notas pero dos parciales tienen un nivel  pesado: Tú decides que quices entregar y cuáles no: Llega tarde y los parciales son difíciles",4.0
1870,"No me gusto para nada su manera de enseñar, era muy extraño intimidante y estricto, dejo por fuera del primer parcial a las personas que llegaron como 5 minutos tarde, casi no se le entendia lo que exlpicaba y se debia estudiar fuera de clase: Muy extraño
Muy estricto
Casi no se le entendia nada",2.0
