,Review,Calification
669,"La docente a lo largo del semestre mantiene una pedagogía poco interactiva, es monótona, se ríe de sus anécdotas y episodios, que por lo general a nadie le causa gracia, al final del semestre hace una o dos preguntas que se responden como ella lo explica y aún asì no se llena sus expectativas de respuesta, es petulante al subestimar a los estudiantes cuando no se adecuan a lo que quiere oir.: Es cumplida en su clase.: Es muy sesgada.",2.0
670,"Muy mala docente, sus clases se centran básicamente en leer diapositivas y en embutirnos sus posturas sobre temas específicos. En el grupo con el que yo estuve, a casi ninguno le motivaba ir a clase, no era dinámica y era muy tediosa. Además, no sentí haber aprendido derecho constitucional a pesar de haber aprobado, faltaron temas muy importantes, ...Leer más...: Impuntual
Poco organizada con las notas
Se tardó mucho enviando el programa
El examen final tuvo una pésima organización",1.5
671,"La clase tiene una buena estructura, cada semana se abordan temas distintos respaldados por una bibliografía adecuada; así mismo la profesora mantiene el ritmo de la clase. Con respecto al examen final oral, aunque se alegan irregularidades, la metodología de este no pudo haber sido otra, a pesar de que fuera extenso, se dieron oportunidades a los ...Leer más...: Los talleres son una buena herramienta de repaso y aprendizaje",5.0
672,"Es de las pocas profesoras que actualiza su programa de acuerdo a la semana coyunturas actuales. A su vez, de la semana pocas profesoras de la facultad que integra el enfoque de género y de sujetos especiales de derecho en sus clases. Siempre hay oportunidades de expresar la semana opiniones y las lecturas son muy completas e incluso alternativas a las qué tradicionalmente se enseñan. : Buenas lecturas
Interesantes talleres 
Perspectivas alternativas ",5.0
673,"La peor clase de derecho: Que pésima clase, solo se limita a decir lo que dicen las diapositivas y lecturas de la clase, las notas son arbitrarias",1.5
674,"Una de las peores clases del pregrado en Derecho. Aunque la materia tiene un tema interesante las clases son horribles, la profesora llega a repetir las mismas cosas que dicen las lecturas y además da la mitad de las clases leyendo diapositivas porque la otra mitad pone a los estudiantes a exponer lo que ella debería enseñar. Por otra parte, la cla...Leer más...: -Clase aburrida.
-Trabajos excesivos.
-Parciales difíciles.
-No entregan notas.
-Califica el monitor.
-La profesora no enseña, solo lee diapositivas.
-La profesora se va de la clase. ",1.5
675,La clase es buena y se abordan los temas mínimos del derecho penal internacional. : La docente maneja el tema. : No tiene la mejor pedagogía. ,5.0
676,El tema de la clase es muy interesante pero la profesora parece estar desactualizada: Es muy puntual: No puede dar clase sin sus diapositivas. La mitad de la clase la dan los estudiantes con las exposiciones,3.0
677,"Alvaro Ortíz, si bien es un gran académico y abogado, como profesor es muy malo y le falta pedagogía. No enseña como debería los temas de la clase que son la base del derecho civil. Su clase es únicamente de ""chisme jurídico"": Los parciales son muy fáciles, la materia se deja alta y usa el libro de Valencia Zea que es muy bueno.",2.0
678,"Excelente abogado, gran docente pero su clase no es recomendada. Debo decir que Ortiz Monsalve tuvo mejores épocas y aunque deja grandes enseñanzas como abogado, no aporta mucho que digamos a la clase, se dedica a hablar de historias y de cuestiones ajenas a los que realmente debería aprenderse, y al final en dos clases de reposición enseña todo el...Leer más...",4.0
679,"El docente es excelente abogado pero pésimo profesor. No enseña, no acompaña el proceso de aprendizaje del estudiante y no va a clases. No lo recomiendo. ",3.0
680,"Es buen profesor; conoce muy bien los temas de los que habla, domina el civil desde bienes y obligaciones como los temas de familia y los temas mas recientes sobre derechos de los niños y parejas homosexuales. Puede ser un tanto reiterativo con la diferencia entre ser estudiante y estudioso pero considero que es por que al ser una persona un tanto ...Leer más...: Comparte su clase con otra profesora lo cual no la hace tan tediosa al ser de 4 horas continuas.
Siempre responderá las dudas con agrado y de forma practica
Tiene visiones críticas frente al derecho: Es muy relajado(pese a mostrarse muy duro las primeras clases) respecto de los estudiates y por tanto se vuelve en una clase en donde van pocos que nunca hablan tornandose en una catedra.
La profesora que dicta la otra mitad es más bien dura con ese gurpo de estudiiantes",4.1
681,"Tiene una metodología de clase dinámica y diferente, lo que hace la clase entretenida, hay constante participación e incluso debate dentro de la clase sobre los temas tratados. Los trabajos no son complicados y se puede obtener una muy buena calificación si se participa y se entregan los trabajos A tiempo: Trabajos poco complejos y lecturas interesantes. No realiza parciales , las notas son los trabajos escritos.",4.6
682,": Ordenada, apasionada por su clase. Dinámica, extrovertida y le interesa que el estudiante aprenda.: Estricta.",5.0
683,Muy buena docente. Aborda los temas de manera integral y es bastante comprensiva en el proceso de aprendizaje. Una de las mejores profesoras que he tenido. : Aborda todos los temas de manera didáctica. ,5.0
684,"La profesora intenta hacer sus clases amenas, es consciente de que esta materia se puede tornar un poco aburrida por el horario tan extenso que maneja, le gusta hacer de su clase un espacio de dialogo.: Es amable con los alumnos
Sabe mucho del tema 
Deja lecturas interesantes : Si no lee sus lecturas puede perder una parte importante del examen
En algunas notas suele ser arbitraria  
",4.0
685,"Al inicio del semestre las clases suelen ser dinámicas, pero después  se vuelven tediosas por la cantidad de información y la forma de dictar la clase que es básicamente leer las diapositivas.
Es importante ser puntual con la entrega de trabajos.: La mayoría de trabajos son fáciles.
: No hay que confiarse en el examen escrito.",3.0
686,"Es una gran profesora, muy amable y dedicada con su labor docente. En el curso se abordaron todos los temas, con un enfoque de métodos cualitativos y cuantitativos, hace talleres para aplicar la teoría a la práctica y se debe entregar un análisis de datos. Excelente clase",5.0
687,": 1. Sus clases son amenas.
2. Fomenta la partipación en la clase.
3. Hay claridad en las notas.
4. Conoce del tema.
5. Es buena persona: 1. Sus clases se limitan en gran medida a una exposición de las diapositivas, no hay mucha profundidad.",4.0
688,"excelente su clase, se nota que es especialista en ese tema. en cuestiones de notas es sencillo tener buena nota final con ella (son trabajos livianos y enriquecedores) ",5.0
689,"Excelente Clase, excelente profesor, muy clara sus explicaciones, muy amable con los estudiantes, se aprende mucho.: se aprende mucho
muy metódico ",5.0
690,"Excelente Profesor, muy esquemático y metódico al enseñar la clase: Su método de evaluación consiste en que los estudiantes realicen escritos abiertos basados en alguna pregunta que él da. : Su método de calificar: de 0.5 en 0.5.  ",3.8
691,"Excelente profesor ! Es muy ordenado con su clase, es muy buena gente, ayuda con todas las dudas. ",5.0
692,"Es una de las personas que más sabe sobre el tema de la seguridad social en el país. El señor es una persona muy amable con los estudiantes y se preocupa por explicar con claridad un tema con tanta legislación y cambios, da espacios para resolver cualquier duda relacionada a la clase. No es para nada una clase exigente, el libro que tiene sobre la ...Leer más...: Materia Sencilla
Tema Interesante: Es muy buena persona y poco exigente con los estudiantes.
La clase es con diapositivas y a veces  estas pueden distraer a los estudiantes de sus explicaciones.
No le gusta calificar con notas intermedias, por lo general califica con 4.0 y 4.5, pocas personas sacan 5.0 ",5.0
693,": Es la mejor cátedra de sucesiones del país, el profesor es eminente: El profesor no es sociable, pero uno no va a buscarlo como amigo sino como docente.",5.0
694,": Es el mejor profesor de sucesiones del país, estudiar con el es un honor, sus clases y sus enseñanzas me han servido en todo momento : no cualquier descerebrado puede con la materia ",5.0
695,"Es un profesor que hace la clase amena, es pedagógico y esquemático. Tiene un gran manejo del tema, se preocupa por abrir a los estudiantes hacia un tema de gran importancia como lo es la Justicia Transicional desde el pregrado. No es un profesor que se preocupe por poner malas notas, al contrario es una persona muy amable, que comprende que los es...Leer más...: Su tono de voz es un poco bajo.",4.7
696,"Por ser una materia importante es mejor verla con otro profesor: Es un profesor muy cordial y sabe del tema: Habla en un volumen muy bajo por lo que es difícil entenderle, le falta ser más didáctico y el avance en los temas es muy oento",3.0
697,"Buen docente, sabe bastante de derecho penal.: Es muy relajado con las notas, se interesa por el aprendizaje de los estudiantes.: Tal vez es por la edad pero tiende a ser muy repetitivo con los temas. Es tan laxo con los vagos y los que no asisten que da malgenio",4.6
698,": Sabe mucho del tema, es muy respetuoso, puntual, tiene mucha experiencia y siempre está abierto a comentarios: No es muy didáctico",4.1
699,"Muy buena profesora. Enseña de manera integral lo referido a investigación y si se trabaja, se puede dejar alta. : Aborda los temas, es cordial y se preocupa por el aprendizaje de los estudiantes. : Podría ser un poco mas laxa. ",5.0
700,"Es buena investigadora. : Si está interesado en la investigación, con ella se aprende bien.  : Si no le agrada la investigación, la materia es un infierno, notas bajas al más mínimo error, controles de asistencia todas las clases. Psicorrígida con las reglas de clase.   ",3.0
701,"La excelencia académica y como docente de diana maria carrillo es fuente de inspiración para mi proceso académico. Y por sobre todo, para mis aspiraciones profesionales y humanas. ",5.0
702,"Muy buena profesora, sin duda una de las mejores. Se aprende muchísimo, es un amor de persona e intenta que su clase no se torne aburrida. Sin duda volvería a ver clases con ella.",5.0
703,"El profesor es tetrico. No enseña nada, solo lee diapositivas, sus parciales son tremendamente mediocres y el final es un video que parece sacado de primaria. Todo el gusto que se puede tener por el derecho procesal es ANIQUILADO en esta clase.: Es facilísima: Hace chistes sobre emojis de WhatsApp
No se aprende NADA 
",1.5
704,"En mi opinión personal, Ferrer es un excelente profesor, sin lugar a dudas el mejor profesor que he tenido este semestre. La materia vale 2 créditos, pero créanme cuando les digo que si usted realiza todas las lecturas, todas los trabajos y todas las columnas, se le tornara como una materia de 4, las lecturas son bastante extensas, además la materi...Leer más...: Excelente metodología.

Se aprende demasiado.

Demasiado exigente.

Se puede dejar por encima de 4 con facilidad, pero eso dependera mucho de su equipo de trabajo.: Demasiado exigente. (lo coloco en ambas por que ajá xd)

Materia de 2 créditos y parece de 4.

Lecturas extensas.

Se le quedara grabado en su vida que es un verbal, jajajaj.",4.5
705,"Le apasiona enseñar, es un buen profesor.: Da bastante apoyo en el proyecto final",4.3
706,"Buen profesor, es una clase muy interdisciplinar y se aprende de todo. Los textos son muy largos y uno se debe esforzar mucho para los poco créditos que tiene la materia. En cuanto a notas es cruel, pero justo.
: Sabe mucho, tiene mucha experiencia: Está un poco loco, hay que tenerle paciencia.",4.5
707,"Es un profesor al que toca leerle, el es un personaje, las clases son entretenidas siempre y cuando uno las prepare, en el trabajo final no califica duro, en general es buen profesor",4.3
708,"Es un excelente profesor y le apasiona enseñar, cambia totalmente el concepto de que metodología de la investigación es una clase aburrida. Eso sí, es de mucho trabajo. Vale dos créditos pero debería valer más. Excelente clase en todos los aspectos.",5.0
709,"Un poco loquito pero buen tipo. Las clases son cheveres, y se habla de temas muy interesantes a mi ver. Ferrer sabe mucho pero es un poco arrogante y rudo, pero gracioso. : Le apasiona los temas
Nos hace gustar los temas
tiene buena didatica
apoya mucho los trabajos: hay que leer un montón, as veces de cosas demasiado aburridas.
Se enfada facilmente
arrogante y rudo",4.0
710,"Me parece un poco pedante en algunos casos, le apasiona enseñar pero a veces es muy arrogante.",3.4
711,"Ferrer es todo un personaje, alguien que se expresa con retorica y elocuencia, sus clases no son de tablero, las lecturas algunas cpmplejas y largar al final son de utilidad. : Hace control de lectura en forma de preguntas al azar 
El proyecto es el 50% y eso ayuda luego de los parciales. : El curso tiene mucha gente y eso impide que el desarrolle mejor la clase. 
Se estresa con facilidad. ",4.0
712,. : Dinámica de clase,5.0
713,"si usted quiere hacer lo que el profesor supuestamente le exigue, preparese para parir, 100 paginas de lectura en sus mejores semanas, hasta 300 en las peores, es genial llegar a un lugar donde se oyen las opiniiones de todos donde la bandera es que las ciencias tienen visiones del mundo que aportarnos a todos, su racionalismo de habermas  lo lleva...Leer más...",2.9
714,"Su materia es interesante, pero no logra profundizar en lo que sería la metodología de la investigación, la verdad sería una materia que debería aportar más. Sin embargo, el hecho del trabajo y el acompañamiento que el profesor brinda son un punto a destacar.",3.7
715,: las lecturas son cheveres: No enseña nada de metodología de investigación,3.1
716,"Sabe de los temas y explica muy bien.: Tono de voz bajo
Arrogante y con actitudes negativas",3.0
717,Excelente profesor. Una de los mejores cursos de la carrera.: Excelentes críticas internas y externas a la economía clásica y neoclásica: Los monitores califican parciales,4.5
718,": Conocimiento del tema.
Material de la clase.: Metodología de la clase.",3.5
719,"Es un excelente profesor tiende un conocimiento profundo no solo de su campo sino también de temas generales y específicos tanto de la economía y otras áreas. Es una excelente persona. Envía los punto de los parciales para que los solucionemos es casi cono transcribir las respuestas a las que llegamos el día del parcial, califica justa e imparcialm...Leer más...: Sabe muchísimo y califica super suave  : La materia tiene un contenido teórico amplio, lo que la hace aburrida en ocaciones.",4.6
720,"El profesor es un estudioso sobre el tema de la pobreza en todas las dimensiones. En torno a la clase, es un poco aburrida por el horario. Normalmente se trabaja en grupo y los parciales están relacionados con unos temas que él deja el primer día de clase y que se van desarrollando a lo largo del curso. Las lecturas son muy interesantes y me han se...Leer más...: Se aprende mucho sobre el tema de política pública (sobre todo en Bogotá) : La clase se torna monótona",4.3
721,"César es una gran persona y sabe bastante, lo único es que el horario es tedioso y la clase se torna aburrida (da demasiado sueño). No deja propiamente muchas lecturas, de hecho no es mucho porque todo es en grupo y él da las preguntas de los parciales (digamos que todo es muy regalado) PERO si deja acumular todo para el parcial, la Expo y el final...Leer más...",3.1
722,"Muy buen profesor, amable y claro en sus explicaciones. Los parciales son largos, pero para un estudiante aplicado no serán muy difíciles. Es una materia que requiere de mucha dedicación.",5.0
723,Sabe demasiado pero es muy noble y algunos estudiantes abusan de eso,4.5
724,: Un excelente tecnico: Ya se jubilo,4.4
725,"Excelente profesora, preocupada por el aprendizaje de los estudiantes, muy querida y excelente académica PhD de Essex. Hace que uno tenga amor por la Econometría y sea muy riguroso.: Clase entretenida, se aprende un montón.: Impuntualidad de la profe. ",5.0
726,"La profesora Hoyos tiene un enorme conocimiento sobre la Econometría. Explica muy bien los temas y sus diapositivas con concisas. Siempre fue amable en resolver mis dudas en su horario de atención extraclase. Los talleres sirvieron para profundizar las temáticas.

Me parecieron malo el profesor asistente (Martínez Sanabria), se suponía que debía de...Leer más...",4.5
727,": Es una materia fácil de aprobar..: Solo va a la clase a leer sus diapositivas.
Es arrogante en el trato a los estudiantes.",2.0
728,"Es una profesora que de ser necesario hace hasta dibujos para hacerse explicar.
Muy paciente y consciente de que es una electiva tomada por estudiantes de varias carreras (Estructura y Problema Agrario)",4.9
729,"Hasta el momento el peor curso que he tenido en la materia, a lo único que se dedicó fue a repetir el tema cada clase. No logra atraer el interés y mucho menos logra avanzar en temas y discusiones importantes de crecimiento económico.",2.1
730,"Se preocupa por que el estudiante interiorice los conceptos básicos, de ahí que pueda ser repetitivo clase tras clase. Los parciales son muy faciles, de a parejas y aveces deja sacar apuntes.",4.0
731,"Es un excelente profesor de macroeconomia, no sé limita a la teoría de los libros, puesto que exige contrastar la teoría con la coyuntura del país. Siempre dispuesto a explicar un tema no entendido. ",5.0
732,"Su clase pierde mucho interés por la metodología del profesor y el ritmo de las sesiones, la experiencia del profesor es muy amplía y valiosa pero la clase realmente no lo es.",2.5
733,": Conoce del tema
Ayuda dependiendo su humor: No genera interés en los estudiantes. Clases monotonas",2.0
734,"Buen tipo, pero no enseña bien. Hizo pocas dinamicas interesantes. Generalmente las clases son basadas en los libros, pero si uno lee apriende más. Los parciales son muy dificiles: Puede ser buena onda: As veces rudo
no genera interés
enseña mal
parciales super dificiles",2.4
735,"El profesor sabe demasiado del conflicto armado colombiano y por lo mismo que le apasiona y logra transmitirlo a los estudiantes. El programa de lecturas es muy chevere, uno se lo goza. Lo único feo es que la mayor parte del tiempo él es el único que se toma la palabra.",4.5
736,": Excelente dominio de demografia, muy atenta, muy respetuosa, le gusta enseñar: Diapositivas",5.0
737,": Es excelente como persona y como docente, se esfuerza para que el estudiante comprenda todos los temas, los parciales son extensos, pero con ir a clase y estudiar las diapositivas se pasan.",4.0
738,"Es más charlado, ejemplificando los temas a la vida real pero en los parciales es específico con apuntes de los autores que suministra en el programa pero con leer el material que complemente la clase, se puede llevar alta.
Se abarcan temas mayormente teóricos : Al hablar y desarrollar la clase refleja el conocimiento que tiene, pero a veces se extiende más
Puntual ",4.7
739,": Eficiente, con mucha clase, un aire de solemnidad que hace que se le tenga mucho respeto: Puede ser algo arrogante",4.6
740,: Ese hombre es un genio,5.0
741,El profesor Luis Lorente ha sido de los mejores profesores que he tenido en mi carrera. Tomé el curso como estudiante de intercambio y éste me facilitó muchas herramientas para ver el crecimiento económico desde un punto de vista más heterodoxo. Es una lástima que no se le dé el reconociento que merece en términos académicos en Colombia.: Vasto conocimiento del tema desde todas las perspectivas posibles.,4.7
742,"Dario es una biblioteca andante, es muy grato poder compartir una charla con una persona tan culta y educada como el profesor. El método de el gira al rededor de los debates, donde usted puede aportar en el momento que crea necesario. Se debe leer mucho, pero las lecturas propuestas son una ganancia personal en mi opinión, le abren la puerta a un mundo que ignora por completo.: - Es una biblioteca andante
- La materia puede llegar a ser aburrida, pero las propuestas y vivencias no dejan que uno pierda el interés : - Las lecturas pueden llegar a ser densas para personas que no pertenezcan a la FCE o Humanas",5.0
743,"La clase es excelente y el docente sabe demasiado, es una materia bastante sencilla que requiere poco esfuerzo, se califican algunos controles de lectura y unos trabajos. : Controles de lectura sencillos
Trabajos sencillos
El profesor es gentil y resuelve las dudas : A veces la clase se torna un poco aburrida",4.5
744,"Grosero y maleducado. Dice que el mercado de la tierra tiene precios negativos porque ""es un mercado que no se comporta como los demás"". 
",1.0
745,"Su materia no aburre, es entretenida, pero el profe es arrogante y a veces humilla a sus estudiantes, los culpa de no saber nada y aprenderse todo de memoria. O incluso a veces por ser católicos.: El profesor logra que uno se mantenga atento en clase.: La clase de por sí es terriblemente densa, entonces hay que memorizar muchos conceptos. ",3.5
746,"Un profesor un poco arrogante y que se tiene mucha seguridad. Sin embargo, ha sido hasta el momento el mejor que he tenido en la carrera, no sólo en el sentido de lo que aprendí academicamente hablando sino para mi vida profesional. Es un profesor duro, pero como él dice, no tiene estudiantes irresponsables. Además a mi forma de ver fomenta muy bie...Leer más...: Sabe del tema 
Excelente clase
No aburre
Materia exigente pero justa: La materia parece densa
A veces es arrogante",4.6
747,Excelente profesor. Es triste que a veces sea arrogante en su forma de expresarse pero sabe demasiado. ,4.3
748,"Es un muy buen profesor, al cual le importa poco la nota y se preocupa mucho que sus estudiantes aprendan sobre la tematica del curso y en general sobre cosas que deberia saber alguien graduado de una universidad de elite, cosas como etiqueta, administracion y presentacion,   las clases son didacticas y los trabajos grupales. Un profesor muy completo, recomendado.: Buen profesor
Se preocupa mucho por sus estudiantes
la nota no es un problema para el",5.0
749,"Es un gran profesor, de los mejores que uno puede encontrar en la facultad. Aunque el tema de la clase es extenso, se aprende bastante con el profesor Beethoven",5.0
750,"Gran profesor, uno de los mejores maestros de la facultad. Sus clases siempre me parecieron entretenidas y las lecturas fueron interesantes. Es amable y se interesa por que los estudiantes entiendan el tema.",5.0
751,"Es excelente persona apoya a sus estudiantes y los motiva a progresar. Al inicio las clases pueden ser aburridas y abrumadoras especialmente por la forma de escribir y hacer apuntes en el tablero, no obstante, una vez uno se adapta a su metodología empieza a coger el ritmo y gusto a las clases, hay que leer en especialmente para los quiz. los parci...Leer más...: Es algo pretenciosos y egocéntrico con respecto a sus conocimientos y títulos. ume tiempo en especial la preparación del ensayo ( consejo no lo hagan sobre los clásicos, el monitor a cargo califica super duro con los temas relacionados a los clásicos)",4.5
752,"Excelente profesor, aunque hubo algo de desorden con los temas, pero explica muy bien: No pregunta nada que no haya mencionado, explica muy bien

Ayuda con los ensayos, presta sus libros y da muchos bonos: Se le dificulta plasmar las ideas en el tablero, lo hace con letra que no se entiende o hace líneas y cuadros desordenados

Con el ensayo final hace Falta retroalimentación, se califica pero uno no sabe que quedó bien y que se debe corregir",4.4
753,"La clase es interesante, el profesor en realidad maneja el tema muy bien; pero la metodología no es buena hay desorden y eso no posibilita un buen aprendizaje. 

En la metodología hay mucho taller  participación en clase en un grupo grande ",4.0
754,El que mete con pecha se la echa,2.5
755,"No es un buen profesor, hay algunos temas que consigue le sean entendidos pero que en la evaluación tienen una dificultad demasiado mayor a los ejemplos que llega a hacer en clase. El trato a los estudiantes es pésimo y la resolución de dudas en la mayoría de los casos es de manera grosera.: Calificación, trato a los estudiantes.",2.0
756,"A un compañero lo llamó imbécil. Trata mal a los estudiantes y usa su poder con la nota para aplastar a otros.
Al final del semestre regala notas dependiendo de quién le cae bien o mal.",1.0
757,"Un pesimo profesor. Los temas son bien complejos pero eso a el le vale y los dicta en 15 minutos. Contesta de muy mala manera a las dudas, los parciales son impasables, es arrogante, y al final pasa a los que el quiere. No tiene pedagogia, su clase es monotona, al final no se aprende na da de el y lo poco que si de una forma muy mediocre.",1.5
758,": La materia depende completamente del estado anímico del sujeto, hay semestres en los que regala el 3, en otras no, el promedio de los parciales nunca supera 1.: Irrespuetuoso, Aroogante",1.0
759,"Sisas, yo veo con PECHA.
P: se
E: la
C: echa
H:
A:: Una vez entendí una cosa que dijo: No, de verdad, no inscriban con él.",1.5
760,"No me atrevo a calificar a este señor como profesor. Es arrogante, prepotente, humilla a los estudiantes, sus clases son malas y el nivel de algunas personas que lograron aprobaron con él deja mucho que desear. Tiene un grupito de lambones que van a idolatrarlo a su oficina.
  ",1.5
